{
  "benchmark_id": "BM-SYNTH-CLASS-A-QUARRY-60F-58C23A82",
  "dataset_id": "SYNTH-CLASS-A-QUARRY-60F",
  "evidence_level": 2,
  "software_commit": "20c62a1",
  "result_state": "PASS",
  "validation_scope": "METRIC_ENGINE_CONTRACT",
  "validation_context": {
    "end_to_end_reconstruction": false,
    "ground_truth_used_for_reconstruction": true,
    "ground_truth_used_for_evaluation_only": false,
    "accuracy_claim_authorized": false,
    "description": "Identity-case verification of benchmark metric implementations using exact CAD geometry."
  },
  "evaluable_axes": [
    "A_VISUAL",
    "B_GEOMETRIC",
    "C_METRIC_SCALE",
    "E_TEXTURE",
    "F_UNCERTAINTY",
    "G_COMPLETENESS"
  ],
  "not_evaluable_axes": [
    "D_GEOSPATIAL"
  ],
  "claim_authorization": {
    "claims_allowed": [
      "gnss_fitting_residual",
      "relative_motion_profile",
      "reprojection_consistency",
      "segment_scale_accuracy",
      "surface_mesh_chamfer",
      "synthetic_recovery_acc",
      "visual_appearance_psnr"
    ],
    "claims_blocked": [
      "horizontal_checkpoint_rmse",
      "probabilistic_gaussian_coverage",
      "radiometric_color_accuracy",
      "surveyed_3d_accuracy",
      "universal_drone_accuracy",
      "vertical_checkpoint_rmse"
    ],
    "policy_status": "PASS",
    "violation_reasons": []
  },
  "metrics": {
    "geometric": {
      "p2p_rmse_m": 0.0,
      "chamfer_distance_m": 0.0,
      "hausdorff_max_m": 0.0,
      "hausdorff_95_m": 0.0,
      "precision_at_5cm": 1.0,
      "recall_at_5cm": 1.0,
      "f1_score_at_5cm": 1.0
    },
    "metric_scale": {
      "rmse_relative_error": 0.0,
      "max_relative_error_pct": 0.0,
      "segment_count": 3
    },
    "trajectory": {
      "ate_raw_rmse_m": 0.0,
      "ate_sim3_aligned_rmse_m": 3.374103965216336e-15,
      "rpe_translational_drift_rmse_m": 0.0
    },
    "perturbation_audit": {
      "perturbation_type": "GNSS_GAUSSIAN_NOISE",
      "magnitude": 1.0,
      "regime": "SUPPORTED_ENVELOPE"
    }
  },
  "timing_profile": {
    "total_wall_clock_sec": 0.29838630000449484,
    "stage_wall_clock_sec": {
      "scene_generation": 0.012415899996994995,
      "trajectory_evaluation": 0.009191700002702419,
      "geometry_evaluation": 0.27642240000568563,
      "metric_scale_evaluation": 0.0002558000051067211,
      "class_b_perturbation": 9.059999865712598e-05
    },
    "input_frames": 60,
    "decoded_duration_sec": 2.0,
    "pipeline_fps": 201.08161802031853,
    "real_time_factor": 0.14919315000224742,
    "latency_tier": "REAL_TIME",
    "hardware_environment": {
      "os": "Windows",
      "os_release": "11",
      "os_version": "10.0.26200",
      "machine": "AMD64",
      "processor": "AMD64 Family 25 Model 117 Stepping 2, AuthenticAMD",
      "python_version": "3.14.7",
      "total_ram_gb": 0.0,
      "cpu_count_logical": 16,
      "cpu_count_physical": 16,
      "gpu_available": false
    }
  },
  "reproducibility": {
    "target_level": "R1_NUMERICAL",
    "observed_level": "R1_NUMERICAL",
    "numerical_tolerance": 1e-05,
    "deterministic_seed": 42,
    "hardware_match": true
  },
  "created_at_utc": "2026-09-03T11:08:16.133471+00:00"
}